{
  "schemaVersion" : "matching.m12.mutants.v1",
  "status" : "PASS",
  "required" : 8,
  "killed" : 8,
  "productionControlsPassed" : 8,
  "singleFaultCandidates" : true,
  "systemErrorCountedAsKill" : false,
  "systemErrorControls" : 3,
  "shrinkTrials" : 32,
  "observer" : "M12_PURE_DATA_HISTORY_OBSERVER_V1",
  "classifier" : "M12_SHARED_FAILURE_CLASSIFIER_V1",
  "semanticModelOnly" : true,
  "realClusterExecuted" : false,
  "eligibleAsClusterEvidence" : false,
  "candidates" : [ {
    "id" : "M12-OFFER-AS-ACK",
    "productionClassification" : "PASS",
    "classification" : "STUDENT_FAILURE",
    "fingerprint" : "ACK_WITHOUT_TRUSTED_RESPONSE",
    "singleFaultMode" : "OFFER_AS_ACK",
    "actualMutationActions" : 1,
    "observer" : "M12_PURE_DATA_HISTORY_OBSERVER_V1",
    "systemErrorCountedAsKill" : false,
    "counterexampleId" : "cex-m12-offer-as-ack",
    "semanticModelOnly" : true,
    "realClusterExecuted" : false,
    "eligibleAsClusterEvidence" : false
  }, {
    "id" : "M12-TIMEOUT-AS-REJECTED",
    "productionClassification" : "PASS",
    "classification" : "STUDENT_FAILURE",
    "fingerprint" : "TIMEOUT_AS_BUSINESS_REJECTION",
    "singleFaultMode" : "TIMEOUT_AS_REJECTED",
    "actualMutationActions" : 1,
    "observer" : "M12_PURE_DATA_HISTORY_OBSERVER_V1",
    "systemErrorCountedAsKill" : false,
    "counterexampleId" : "cex-m12-timeout-as-rejected",
    "semanticModelOnly" : true,
    "realClusterExecuted" : false,
    "eligibleAsClusterEvidence" : false
  }, {
    "id" : "M12-RETRY-WITH-NEW-IDENTITY",
    "productionClassification" : "PASS",
    "classification" : "STUDENT_FAILURE",
    "fingerprint" : "UNKNOWN_RETRY_CHANGED_DURABLE_IDENTITY",
    "singleFaultMode" : "RETRY_WITH_NEW_IDENTITY",
    "actualMutationActions" : 1,
    "observer" : "M12_PURE_DATA_HISTORY_OBSERVER_V1",
    "systemErrorCountedAsKill" : false,
    "counterexampleId" : "cex-m12-retry-with-new-identity",
    "semanticModelOnly" : true,
    "realClusterExecuted" : false,
    "eligibleAsClusterEvidence" : false
  }, {
    "id" : "M12-DUPLICATE-AS-NEW-EFFECT",
    "productionClassification" : "PASS",
    "classification" : "STUDENT_FAILURE",
    "fingerprint" : "DUPLICATE_CREATED_SECOND_EFFECT",
    "singleFaultMode" : "DUPLICATE_AS_NEW_EFFECT",
    "actualMutationActions" : 1,
    "observer" : "M12_PURE_DATA_HISTORY_OBSERVER_V1",
    "systemErrorCountedAsKill" : false,
    "counterexampleId" : "cex-m12-duplicate-as-new-effect",
    "semanticModelOnly" : true,
    "realClusterExecuted" : false,
    "eligibleAsClusterEvidence" : false
  }, {
    "id" : "M12-MINORITY-ACK",
    "productionClassification" : "PASS",
    "classification" : "STUDENT_FAILURE",
    "fingerprint" : "MINORITY_ACKNOWLEDGED",
    "singleFaultMode" : "MINORITY_ACK",
    "actualMutationActions" : 1,
    "observer" : "M12_PURE_DATA_HISTORY_OBSERVER_V1",
    "systemErrorCountedAsKill" : false,
    "counterexampleId" : "cex-m12-minority-ack",
    "semanticModelOnly" : true,
    "realClusterExecuted" : false,
    "eligibleAsClusterEvidence" : false
  }, {
    "id" : "M12-ACCEPT-STALE-LEADER-AUTHORITY",
    "productionClassification" : "PASS",
    "classification" : "STUDENT_FAILURE",
    "fingerprint" : "STALE_LEADER_ACKNOWLEDGED",
    "singleFaultMode" : "ACCEPT_STALE_LEADER_AUTHORITY",
    "actualMutationActions" : 1,
    "observer" : "M12_PURE_DATA_HISTORY_OBSERVER_V1",
    "systemErrorCountedAsKill" : false,
    "counterexampleId" : "cex-m12-accept-stale-leader-authority",
    "semanticModelOnly" : true,
    "realClusterExecuted" : false,
    "eligibleAsClusterEvidence" : false
  }, {
    "id" : "M12-DROP-IDENTITY-DURING-CATCH-UP",
    "productionClassification" : "PASS",
    "classification" : "STUDENT_FAILURE",
    "fingerprint" : "FOLLOWER_IDENTITY_TABLE_DIVERGED",
    "singleFaultMode" : "DROP_IDENTITY_DURING_CATCH_UP",
    "actualMutationActions" : 1,
    "observer" : "M12_PURE_DATA_HISTORY_OBSERVER_V1",
    "systemErrorCountedAsKill" : false,
    "counterexampleId" : "cex-m12-drop-identity-during-catch-up",
    "semanticModelOnly" : true,
    "realClusterExecuted" : false,
    "eligibleAsClusterEvidence" : false
  }, {
    "id" : "M12-INCLUDE-TERM-IN-SEMANTIC-DIGEST",
    "productionClassification" : "PASS",
    "classification" : "STUDENT_FAILURE",
    "fingerprint" : "RUNTIME_METADATA_CHANGED_SEMANTIC_DIGEST",
    "singleFaultMode" : "INCLUDE_TERM_IN_SEMANTIC_DIGEST",
    "actualMutationActions" : 1,
    "observer" : "M12_PURE_DATA_HISTORY_OBSERVER_V1",
    "systemErrorCountedAsKill" : false,
    "counterexampleId" : "cex-m12-include-term-in-semantic-digest",
    "semanticModelOnly" : true,
    "realClusterExecuted" : false,
    "eligibleAsClusterEvidence" : false
  } ],
  "controls" : [ {
    "id" : "M12-NON-LEADER-FAULT-TARGET-CONTROL",
    "classification" : "SYSTEM_ERROR",
    "classifier" : "M12_SHARED_FAILURE_CLASSIFIER_V1",
    "countedAsKill" : false,
    "executedPath" : "M12InfrastructurePreconditions#requireCurrentLeaderFaultTarget",
    "failureType" : "IllegalStateException"
  }, {
    "id" : "M12-CLUSTER-STARTUP-CONTROL",
    "classification" : "SYSTEM_ERROR",
    "classifier" : "M12_SHARED_FAILURE_CLASSIFIER_V1",
    "countedAsKill" : false,
    "executedPath" : "M12InfrastructurePreconditions#requireStaticLaunchTopology",
    "failureType" : "IllegalStateException"
  }, {
    "id" : "M12-CORRUPT-HISTORY-OUTPUT-CONTROL",
    "classification" : "SYSTEM_ERROR",
    "classifier" : "M12_SHARED_FAILURE_CLASSIFIER_V1",
    "countedAsKill" : false,
    "executedPath" : "M12InfrastructurePreconditions#parseHistory",
    "failureType" : "FixtureSchemaException"
  } ]
}
